{
  "gate": 1,
  "phase": 3,
  "fr_id": "FR-04",
  "overall_score": 95.87878787878788,
  "quality_complete": true,
  "rounds_used": 1,
  "breakdown": {
    "linting": {
      "score": 100.0,
      "threshold": 100,
      "tool_evidence": "All checks passed!\n"
    },
    "type_safety": {
      "score": 100.0,
      "threshold": 100,
      "tool_evidence": "{\n    \"version\": \"1.1.409\",\n    \"time\": \"1785359861923\",\n    \"generalDiagnostics\": [],\n    \"summary\": {\n        \"filesAnalyzed\": 19,\n        \"errorCount\": 0,\n        \"warningCount\": 0,\n        \"informationCount\": 0,\n        \"timeInSec\": 0.508\n    }\n}\n\n"
    },
    "test_coverage": {
      "score": 87.87878787878788,
      "threshold": 80,
      "tests_passed": 4,
      "tests_failed": 0,
      "tests_skipped": 0,
      "tool_evidence": "============================= test session starts ==============================\nplatform darwin -- Python 3.11.15, pytest-8.4.2, pluggy-1.6.0\nbenchmark: 5.2.3 (defaults: timer=time.perf_counter disable_gc=False min_rounds=5 min_time=0.000005 max_time=1.0 calibration_precision=10 warmup=False warmup_iterations=100000)\nrootdir: /tmp/taskq-plus\nplugins: benchmark-5.2.3, cov-7.1.0, anyio-4.14.2\ncollected 4 items\n\n03-development/tests/test_fr04.py ....                              "
    }
  },
  "enforcer_sha": "c3451a61a9b595821572c38468f6971916343dae",
  "open_critical_count": 0,
  "open_high_count": 0,
  "composite_score": 95.8788,
  "verdict": "PASS",
  "passed": true
}